{"schema_version":"0.1.0","brief":{"question":"What responsibility, if any, did the United States have in Brazil's dictatorship period?","outcome":"Classify responsibility by category and period.","scope":"1964 overthrow and early consolidation; not every 1964–1985 act.","level":5,"level_rationale":"Historical and reputationally consequential claim.","permissions":["public archives only"],"evidence_regimes":["historical-provenance","interests-and-disclosure"],"decision_owner":"human reviewer"},"plan":{"plan_id":"PLAN-03","provider_reconciliation":[{"provider":"chatgpt","adapter":"adapters/chatgpt.md","structural_state":"compatible","runtime_state":"not-executed"},{"provider":"claude","adapter":"adapters/claude.md","structural_state":"compatible","runtime_state":"not-executed"},{"provider":"gemini","adapter":"adapters/gemini.md","structural_state":"compatible","runtime_state":"not-executed"}],"workstreams":[{"workstream_id":"WS-01","question":"What did U.S. officials know, plan, and do?","evidence_target":"dated primary diplomatic records","role":"provenance-auditor","stop_condition":"responsibility categories remain distinct"}],"stop_conditions":["Do not generalize 1964 evidence to all later years.","Do not erase Brazilian agency."]},"sources":[{"source_id":"SR-001","author":"A. Lincoln Gordon","title":"Telegram From the Ambassador to Brazil to the Department of State, document 187","source_type":"primary diplomatic telegram","venue":"Foreign Relations of the United States","published_at":"1964-03-28","accessed_at":"2026-08-14","url":"https://history.state.gov/historicaldocuments/frus1964-68v31/d187","status":"validated","independence_group":"U.S. diplomatic archive"},{"source_id":"SR-002","author":"Office of the Historian, U.S. Department of State","title":"Editorial Note, document 196","source_type":"archival editorial synthesis","venue":"Foreign Relations of the United States","published_at":"1964-03-31","accessed_at":"2026-08-14","url":"https://history.state.gov/historicaldocuments/frus1964-68v31/d196","status":"validated","independence_group":"U.S. diplomatic archive"},{"source_id":"SR-003","author":"U.S. Department of State","title":"Telegram From the Department of State to the Embassy in Brazil, document 198","source_type":"primary diplomatic instruction","venue":"Foreign Relations of the United States","published_at":"1964-03-31","accessed_at":"2026-08-14","url":"https://history.state.gov/historicaldocuments/frus1964-68v31/d198","status":"validated","independence_group":"U.S. diplomatic archive"},{"source_id":"SR-004","author":"A. Lincoln Gordon","title":"Telegram From the Embassy in Brazil to the Department of State, document 211","source_type":"primary diplomatic telegram","venue":"Foreign Relations of the United States","published_at":"1964-04-10","accessed_at":"2026-08-14","url":"https://history.state.gov/historicaldocuments/frus1964-68v31/d211","status":"validated","independence_group":"U.S. diplomatic archive"},{"source_id":"SR-005","author":"Comissão Nacional da Verdade","title":"Relatório Final","source_type":"official investigative report","venue":"Memórias Reveladas / Arquivo Nacional","published_at":"2014-01-01","accessed_at":"2026-08-14","url":"https://www.gov.br/memoriasreveladas/pt-br/assuntos/comissoes-da-verdade/cnv","status":"verified","independence_group":"Brazilian truth commission"}],"claims":[{"claim_id":"CL-001","claim_type":"observation","statement":"Gordon recommended preparing clandestine arms and fuel support and possible overt intervention.","citations":["SR-001"],"support_status":"supported"},{"claim_id":"CL-002","claim_type":"observation","statement":"U.S. officials considered naval, fuel, airlift, and post-coup assistance contingencies.","citations":["SR-002","SR-003"],"support_status":"supported"},{"claim_id":"CL-003","claim_type":"observation","statement":"Gordon later argued for generous support to the successor government.","citations":["SR-004"],"support_status":"supported"},{"claim_id":"CL-004","claim_type":"inference","statement":"The U.S. was not a neutral observer and prepared political and material support.","citations":["SR-001","SR-002","SR-003","SR-004"],"support_status":"supported"},{"claim_id":"CL-005","claim_type":"judgment","statement":"The U.S. bears meaningful but non-exclusive responsibility for support and preparation around the 1964 overthrow and early consolidation.","citations":["SR-001","SR-002","SR-003","SR-004"],"support_status":"supported"},{"claim_id":"CL-006","claim_type":"open_question","statement":"Responsibility for later repression and each administration requires separate evidence.","citations":["SR-005"],"support_status":"insufficient"}],"handoffs":[{"handoff_id":"HO-01","role":"provenance-auditor","work_performed":"Mapped document custody, date, and responsibility categories.","claim_ids":["CL-001","CL-002","CL-003"],"source_ids":["SR-001","SR-002","SR-003","SR-004"],"gaps":["Brazilian primary archives and later-period work pending."],"recommended_next_action":"challenge causal overreach"},{"handoff_id":"HO-02","role":"challenger","work_performed":"Tested neutral-observer and sole-cause framings.","claim_ids":["CL-004","CL-005","CL-006"],"source_ids":["SR-001","SR-002","SR-003","SR-004","SR-005"],"gaps":[],"recommended_next_action":"separate later-period workstreams"}],"dossier":{"dossier_id":"DOS-03","title":"U.S. responsibility during Brazil's dictatorship","plan_id":"PLAN-03","claim_ids":["CL-001","CL-002","CL-003","CL-004","CL-005","CL-006"],"conclusion":"The documented responsibility is significant but not exclusive; the evidence does not establish sole U.S. causation or every later responsibility.","confidence_rationale":"Dated primary records support scoped categories and reject extremes.","limitations":["Later-period responsibility not investigated.","U.S.-custody records require Brazilian archival supplementation."],"revalidation":{"triggers":["New primary archives or a scope expansion beyond 1964 and early consolidation."],"owner":"human historical reviewer"}}}
