{"schema_version":"0.1.0","brief":{"question":"Is chloroquine or hydroxychloroquine effective for COVID-19 treatment, for which outcomes and populations?","outcome":"Evaluate the treatment claim without medical advice.","scope":"COVID-19 treatment; excludes approved non-COVID uses and prophylaxis.","level":5,"level_rationale":"Medical claim with contested evidence and potential harm.","permissions":["public sources only"],"evidence_regimes":["scientific-critical","interests-and-disclosure"],"decision_owner":"human reviewer"},"plan":{"plan_id":"PLAN-01","provider_reconciliation":[{"provider":"chatgpt","adapter":"adapters/chatgpt.md","structural_state":"compatible","runtime_state":"not-executed"},{"provider":"claude","adapter":"adapters/claude.md","structural_state":"compatible","runtime_state":"not-executed"},{"provider":"gemini","adapter":"adapters/gemini.md","structural_state":"compatible","runtime_state":"not-executed"}],"workstreams":[{"workstream_id":"WS-01","question":"What do systematic synthesis and regulators establish?","evidence_target":"trials, synthesis, safety","role":"scientific-method-auditor","stop_condition":"material claims have inspected sources"}],"stop_conditions":["Do not issue treatment advice.","Escalate if new controlled evidence changes synthesis."]},"sources":[{"source_id":"SR-001","author":"World Health Organization","title":"Coronavirus disease (COVID-19): Hydroxychloroquine","source_type":"guidance","venue":"WHO","published_at":"2025-04-23","accessed_at":"2026-08-14","url":"https://www.who.int/news-room/questions-and-answers/item/coronavirus-disease-%28covid-19%29-hydroxychloroquine","status":"validated","independence_group":"WHO evidence guideline"},{"source_id":"SR-002","author":"Singh et al.","title":"Chloroquine or hydroxychloroquine for prevention and treatment of COVID-19","source_type":"systematic review","venue":"Cochrane Database of Systematic Reviews","published_at":"2021-02-18","accessed_at":"2026-08-14","url":"doi:10.1002/14651858.CD013587.pub2","status":"validated","independence_group":"Cochrane review"},{"source_id":"SR-003","author":"U.S. Food and Drug Administration","title":"FDA Revokes Emergency Use Authorization for Chloroquine and Hydroxychloroquine","source_type":"regulatory announcement","venue":"FDA","published_at":"2020-06-15","accessed_at":"2026-08-14","url":"https://www.fda.gov/news-events/press-announcements/coronavirus-covid-19-update-fda-revokes-emergency-use-authorization-chloroquine-and","status":"verified","independence_group":"FDA regulatory record"}],"claims":[{"claim_id":"CL-001","claim_type":"derived_fact","statement":"WHO guidance reports no treatment recommendation and no mortality or ventilation benefit in its reviewed trials.","citations":["SR-001"],"support_status":"supported"},{"claim_id":"CL-002","claim_type":"source_claim","statement":"Cochrane concluded hydroxychloroquine had little or no mortality effect and probably no ventilation benefit.","citations":["SR-002"],"support_status":"supported"},{"claim_id":"CL-003","claim_type":"source_claim","statement":"FDA revoked the EUA after finding the drugs unlikely to be effective for the authorized use.","citations":["SR-003"],"support_status":"supported"},{"claim_id":"CL-004","claim_type":"inference","statement":"For COVID-19 treatment, the reviewed evidence does not show clinically useful benefit outweighing relevant risks.","citations":["SR-001","SR-002","SR-003"],"support_status":"supported"}],"handoffs":[{"handoff_id":"HO-01","role":"scientific-method-auditor","work_performed":"Separated treatment, prevention, efficacy, and regulatory evidence.","claim_ids":["CL-001","CL-002","CL-003"],"source_ids":["SR-001","SR-002","SR-003"],"gaps":["Primary-trial audit and full funding map pending."],"recommended_next_action":"challenge and synthesize"},{"handoff_id":"HO-02","role":"challenger","work_performed":"Tested early-study and scope objections.","claim_ids":["CL-004"],"source_ids":["SR-001","SR-002","SR-003"],"gaps":[],"recommended_next_action":"revalidate on material new controlled evidence"}],"dossier":{"dossier_id":"DOS-01","title":"Chloroquine / hydroxychloroquine and COVID-19","plan_id":"PLAN-01","claim_ids":["CL-001","CL-002","CL-003","CL-004"],"conclusion":"The evaluated synthesis and regulatory evidence does not support clinically useful COVID-19 treatment benefit; this excludes no approved non-COVID use.","confidence_rationale":"Convergent synthesis and regulator record, with scope preserved.","limitations":["Not a full primary-trial audit.","Not medical advice."],"revalidation":{"triggers":["Material new controlled evidence changes synthesis."],"owner":"human medical reviewer"}}}
