{"schema_version":"0.1.0","brief":{"question":"Does example claim hold?","outcome":"learn","scope":"test","level":3,"level_rationale":"multi-source","permissions":[]},"plan":{"plan_id":"PLAN-001","workstreams":[],"stop_conditions":[]},"sources":[{"source_id":"SR-001","author":"Example Institution","title":"Example source","source_type":"report","venue":"Example repository","published_at":"2026-08-14","accessed_at":"2026-08-14","url":"https://example.test/source","status":"verified","independence_group":"example"}],"claims":[{"claim_id":"CL-001","claim_type":"source_claim","statement":"The example source makes a claim.","citations":["SR-001"],"support_status":"supported"}],"handoffs":[{"handoff_id":"HO-001","role":"evidence-verifier","work_performed":"Normalized source.","claim_ids":["CL-001"],"source_ids":["SR-001"],"gaps":[],"recommended_next_action":"challenge"}],"dossier":{"dossier_id":"DOS-001","title":"Example dossier","plan_id":"PLAN-001","claim_ids":["CL-001"],"conclusion":"Illustrative only.","confidence_rationale":"Fixture.","limitations":[],"revalidation":{"triggers":[],"owner":"test"}}}